drop table if exists t1;
create table t1 (a int unsigned)
partition by list (a)
(partition p0 values in (0),
partition p1 values in (1),
partition pnull values in (null),
partition p2 values in (2));
insert into t1 values (null),(0),(1),(2);
select * from t1 where a < 2;
a
0
1
select * from t1 where a <= 0;
a
0
select * from t1 where a < 1;
a
0
select * from t1 where a > 0;
a
1
2
select * from t1 where a > 1;
a
2
select * from t1 where a >= 0;
a
0
1
2
select * from t1 where a >= 1;
a
1
2
select * from t1 where a is null;
a
NULL
select * from t1 where a is not null;
a
0
1
2
select * from t1 where a is null or a > 0;
a
1
NULL
2
drop table t1;
create table t1 (a int unsigned, b int)
partition by list (a)
subpartition by hash (b)
subpartitions 2
(partition p0 values in (0),
partition p1 values in (1),
partition pnull values in (null, 2),
partition p3 values in (3));
select partition_method, partition_expression, partition_description
from information_schema.partitions where table_name = "t1";
partition_method	partition_expression	partition_description
LIST	a	0
LIST	a	0
LIST	a	1
LIST	a	1
LIST	a	NULL,2
LIST	a	NULL,2
LIST	a	3
LIST	a	3
insert into t1 values (0,0),(0,1),(1,0),(1,1),(null,0),(null,1);
insert into t1 values (2,0),(2,1),(3,0),(3,1);
explain partitions select * from t1 where a is null;
id	select_type	table	partitions	type	possible_keys	key	key_len	ref	rows	Extra
1	SIMPLE	t1	pnull_pnullsp0,pnull_pnullsp1	ALL	NULL	NULL	NULL	NULL	4	Using where
select * from t1 where a is null;
a	b
NULL	0
NULL	1
explain partitions select * from t1 where a = 2;
id	select_type	table	partitions	type	possible_keys	key	key_len	ref	rows	Extra
1	SIMPLE	t1	pnull_pnullsp0,pnull_pnullsp1	ALL	NULL	NULL	NULL	NULL	4	Using where
select * from t1 where a = 2;
a	b
2	0
2	1
select * from t1 where a <= 0;
a	b
0	0
0	1
select * from t1 where a < 3;
a	b
0	0
0	1
1	0
1	1
2	0
2	1
select * from t1 where a >= 1 or a is null;
a	b
1	0
1	1
NULL	0
2	0
NULL	1
2	1
3	0
3	1
drop table t1;
CREATE TABLE t1 (
a int not null,
b int not null,
c int not null)
partition by list(a)
partitions 2
(partition x123 values in (1,5,6),
partition x234 values in (4,7,8));
INSERT into t1 VALUES (1,1,1);
INSERT into t1 VALUES (2,1,1);
ERROR HY000: Table has no partition for value 2
INSERT into t1 VALUES (3,1,1);
ERROR HY000: Table has no partition for value 3
INSERT into t1 VALUES (4,1,1);
INSERT into t1 VALUES (5,1,1);
INSERT into t1 VALUES (6,1,1);
INSERT into t1 VALUES (7,1,1);
INSERT into t1 VALUES (8,1,1);
INSERT into t1 VALUES (9,1,1);
ERROR HY000: Table has no partition for value 9
INSERT into t1 VALUES (1,2,1);
INSERT into t1 VALUES (1,3,1);
INSERT into t1 VALUES (1,4,1);
INSERT into t1 VALUES (7,2,1);
INSERT into t1 VALUES (7,3,1);
INSERT into t1 VALUES (7,4,1);
SELECT * from t1;
a	b	c
1	1	1
5	1	1
6	1	1
1	2	1
1	3	1
1	4	1
4	1	1
7	1	1
8	1	1
7	2	1
7	3	1
7	4	1
SELECT * from t1 WHERE a=1;
a	b	c
1	1	1
1	2	1
1	3	1
1	4	1
SELECT * from t1 WHERE a=7;
a	b	c
7	1	1
7	2	1
7	3	1
7	4	1
SELECT * from t1 WHERE b=2;
a	b	c
1	2	1
7	2	1
UPDATE t1 SET a=8 WHERE a=7 AND b=3;
SELECT * from t1;
a	b	c
1	1	1
5	1	1
6	1	1
1	2	1
1	3	1
1	4	1
4	1	1
7	1	1
8	1	1
7	2	1
8	3	1
7	4	1
UPDATE t1 SET a=8 WHERE a=5 AND b=1;
SELECT * from t1;
a	b	c
1	1	1
6	1	1
1	2	1
1	3	1
1	4	1
4	1	1
7	1	1
8	1	1
7	2	1
8	3	1
7	4	1
8	1	1
DELETE from t1 WHERE a=8;
SELECT * from t1;
a	b	c
1	1	1
6	1	1
1	2	1
1	3	1
1	4	1
4	1	1
7	1	1
7	2	1
7	4	1
DELETE from t1 WHERE a=2;
SELECT * from t1;
a	b	c
1	1	1
6	1	1
1	2	1
1	3	1
1	4	1
4	1	1
7	1	1
7	2	1
7	4	1
DELETE from t1 WHERE a=5 OR a=6;
SELECT * from t1;
a	b	c
1	1	1
1	2	1
1	3	1
1	4	1
4	1	1
7	1	1
7	2	1
7	4	1
ALTER TABLE t1
partition by list(a)
partitions 2
(partition x123 values in (1,5,6),
partition x234 values in (4,7,8));
SELECT * from t1;
a	b	c
1	1	1
1	2	1
1	3	1
1	4	1
4	1	1
7	1	1
7	2	1
7	4	1
INSERT into t1 VALUES (6,2,1);
INSERT into t1 VALUES (2,2,1);
ERROR HY000: Table has no partition for value 2
drop table t1;
CREATE TABLE t1 (
a int not null,
b int not null,
c int not null,
primary key (a,b))
partition by list (a)
subpartition by hash (a+b)
( partition x1 values in (1,2,3)
( subpartition x11 nodegroup 0,
subpartition x12 nodegroup 1),
partition x2 values in (4,5,6)
( subpartition x21 nodegroup 0,
subpartition x22 nodegroup 1)
);
INSERT into t1 VALUES (1,1,1);
INSERT into t1 VALUES (4,1,1);
INSERT into t1 VALUES (7,1,1);
ERROR HY000: Table has no partition for value 7
UPDATE t1 SET a=5 WHERE a=1;
SELECT * from t1;
a	b	c
5	1	1
4	1	1
UPDATE t1 SET a=6 WHERE a=4;
SELECT * from t1;
a	b	c
5	1	1
6	1	1
DELETE from t1 WHERE a=6;
SELECT * from t1;
a	b	c
5	1	1
drop table t1;
CREATE TABLE t1 ( 
a int not null,
b int not null,
c int not null,
primary key(a,b))
partition by list (a)
(partition x1 values in (1,2,9,4) tablespace ts1);
drop table t1;
CREATE TABLE t1 (s1 int) PARTITION BY LIST (s1) 
(PARTITION p1 VALUES IN (1),
PARTITION p2 VALUES IN (2),
PARTITION p3 VALUES IN (3),
PARTITION p4 VALUES IN (4),
PARTITION p5 VALUES IN (5));
INSERT INTO t1 VALUES (1), (2), (3), (4), (5);
SELECT COUNT(*) FROM t1 WHERE s1 < 3;
COUNT(*)
2
DROP TABLE t1;
create table t1 (a int auto_increment primary key)
auto_increment=100
partition by list (a)
(partition p0 values in (1, 100));
create index inx on t1 (a);
insert into t1 values (null);
select * from t1;
a
100
drop table t1;
create table t1 (a char(1))
partition by list (ascii(ucase(a)))
(partition p1 values in (2));
ERROR HY000: This partition function is not allowed
#
# UTC_EXTRACT
#
SET @old_time_zone= @@SESSION.time_zone;
SET @@SESSION.time_zone = 'UTC';
CREATE TABLE t1 (a INT AUTO_INCREMENT, b TIMESTAMP NOT NULL,
PRIMARY KEY (a, b)) ENGINE=MyISAM
PARTITION BY LIST (UTC_EXTRACT(YEAR_MONTH_DAY FROM b))
(PARTITION `p0` VALUES IN (20010101),
PARTITION `p1` VALUES IN (20010102),
PARTITION `p2` VALUES IN (20010103));
INSERT INTO t1 (b) VALUES (TIMESTAMPADD(HOUR, 0, '2001-01-01 00:00:00'));
INSERT INTO t1 (b) VALUES (TIMESTAMPADD(HOUR, 1, '2001-01-01 00:00:00'));
INSERT INTO t1 (b) VALUES (TIMESTAMPADD(HOUR, 2, '2001-01-01 00:00:00'));
INSERT INTO t1 (b) VALUES (TIMESTAMPADD(HOUR, 3, '2001-01-01 00:00:00'));
INSERT INTO t1 (b) VALUES (TIMESTAMPADD(HOUR, 4, '2001-01-01 00:00:00'));
INSERT INTO t1 (b) VALUES (TIMESTAMPADD(HOUR, 5, '2001-01-01 00:00:00'));
INSERT INTO t1 (b) VALUES (TIMESTAMPADD(HOUR, 6, '2001-01-01 00:00:00'));
INSERT INTO t1 (b) VALUES (TIMESTAMPADD(HOUR, 7, '2001-01-01 00:00:00'));
INSERT INTO t1 (b) VALUES (TIMESTAMPADD(HOUR, 8, '2001-01-01 00:00:00'));
INSERT INTO t1 (b) VALUES (TIMESTAMPADD(HOUR, 9, '2001-01-01 00:00:00'));
INSERT INTO t1 (b) VALUES (TIMESTAMPADD(HOUR, 10, '2001-01-01 00:00:00'));
INSERT INTO t1 (b) VALUES (TIMESTAMPADD(HOUR, 11, '2001-01-01 00:00:00'));
INSERT INTO t1 (b) VALUES (TIMESTAMPADD(HOUR, 12, '2001-01-01 00:00:00'));
INSERT INTO t1 (b) VALUES (TIMESTAMPADD(HOUR, 13, '2001-01-01 00:00:00'));
INSERT INTO t1 (b) VALUES (TIMESTAMPADD(HOUR, 14, '2001-01-01 00:00:00'));
INSERT INTO t1 (b) VALUES (TIMESTAMPADD(HOUR, 15, '2001-01-01 00:00:00'));
INSERT INTO t1 (b) VALUES (TIMESTAMPADD(HOUR, 16, '2001-01-01 00:00:00'));
INSERT INTO t1 (b) VALUES (TIMESTAMPADD(HOUR, 17, '2001-01-01 00:00:00'));
INSERT INTO t1 (b) VALUES (TIMESTAMPADD(HOUR, 18, '2001-01-01 00:00:00'));
INSERT INTO t1 (b) VALUES (TIMESTAMPADD(HOUR, 19, '2001-01-01 00:00:00'));
INSERT INTO t1 (b) VALUES (TIMESTAMPADD(HOUR, 20, '2001-01-01 00:00:00'));
INSERT INTO t1 (b) VALUES (TIMESTAMPADD(HOUR, 21, '2001-01-01 00:00:00'));
INSERT INTO t1 (b) VALUES (TIMESTAMPADD(HOUR, 22, '2001-01-01 00:00:00'));
INSERT INTO t1 (b) VALUES (TIMESTAMPADD(HOUR, 23, '2001-01-01 00:00:00'));
INSERT INTO t1 (b) VALUES (TIMESTAMPADD(HOUR, 24, '2001-01-01 00:00:00'));
INSERT INTO t1 (b) VALUES (TIMESTAMPADD(HOUR, 25, '2001-01-01 00:00:00'));
INSERT INTO t1 (b) VALUES (TIMESTAMPADD(HOUR, 26, '2001-01-01 00:00:00'));
INSERT INTO t1 (b) VALUES (TIMESTAMPADD(HOUR, 27, '2001-01-01 00:00:00'));
INSERT INTO t1 (b) VALUES (TIMESTAMPADD(HOUR, 28, '2001-01-01 00:00:00'));
INSERT INTO t1 (b) VALUES (TIMESTAMPADD(HOUR, 29, '2001-01-01 00:00:00'));
INSERT INTO t1 (b) VALUES (TIMESTAMPADD(HOUR, 30, '2001-01-01 00:00:00'));
INSERT INTO t1 (b) VALUES (TIMESTAMPADD(HOUR, 31, '2001-01-01 00:00:00'));
INSERT INTO t1 (b) VALUES (TIMESTAMPADD(HOUR, 32, '2001-01-01 00:00:00'));
INSERT INTO t1 (b) VALUES (TIMESTAMPADD(HOUR, 33, '2001-01-01 00:00:00'));
INSERT INTO t1 (b) VALUES (TIMESTAMPADD(HOUR, 34, '2001-01-01 00:00:00'));
INSERT INTO t1 (b) VALUES (TIMESTAMPADD(HOUR, 35, '2001-01-01 00:00:00'));
INSERT INTO t1 (b) VALUES (TIMESTAMPADD(HOUR, 36, '2001-01-01 00:00:00'));
INSERT INTO t1 (b) VALUES (TIMESTAMPADD(HOUR, 37, '2001-01-01 00:00:00'));
INSERT INTO t1 (b) VALUES (TIMESTAMPADD(HOUR, 38, '2001-01-01 00:00:00'));
INSERT INTO t1 (b) VALUES (TIMESTAMPADD(HOUR, 39, '2001-01-01 00:00:00'));
INSERT INTO t1 (b) VALUES (TIMESTAMPADD(HOUR, 40, '2001-01-01 00:00:00'));
INSERT INTO t1 (b) VALUES (TIMESTAMPADD(HOUR, 41, '2001-01-01 00:00:00'));
INSERT INTO t1 (b) VALUES (TIMESTAMPADD(HOUR, 42, '2001-01-01 00:00:00'));
INSERT INTO t1 (b) VALUES (TIMESTAMPADD(HOUR, 43, '2001-01-01 00:00:00'));
INSERT INTO t1 (b) VALUES (TIMESTAMPADD(HOUR, 44, '2001-01-01 00:00:00'));
INSERT INTO t1 (b) VALUES (TIMESTAMPADD(HOUR, 45, '2001-01-01 00:00:00'));
INSERT INTO t1 (b) VALUES (TIMESTAMPADD(HOUR, 46, '2001-01-01 00:00:00'));
INSERT INTO t1 (b) VALUES (TIMESTAMPADD(HOUR, 47, '2001-01-01 00:00:00'));
INSERT INTO t1 (b) VALUES (TIMESTAMPADD(HOUR, 48, '2001-01-01 00:00:00'));
INSERT INTO t1 (b) VALUES (TIMESTAMPADD(HOUR, 49, '2001-01-01 00:00:00'));
INSERT INTO t1 (b) VALUES (TIMESTAMPADD(HOUR, 50, '2001-01-01 00:00:00'));
INSERT INTO t1 (b) VALUES (TIMESTAMPADD(HOUR, 51, '2001-01-01 00:00:00'));
INSERT INTO t1 (b) VALUES (TIMESTAMPADD(HOUR, 52, '2001-01-01 00:00:00'));
INSERT INTO t1 (b) VALUES (TIMESTAMPADD(HOUR, 53, '2001-01-01 00:00:00'));
INSERT INTO t1 (b) VALUES (TIMESTAMPADD(HOUR, 54, '2001-01-01 00:00:00'));
INSERT INTO t1 (b) VALUES (TIMESTAMPADD(HOUR, 55, '2001-01-01 00:00:00'));
INSERT INTO t1 (b) VALUES (TIMESTAMPADD(HOUR, 56, '2001-01-01 00:00:00'));
INSERT INTO t1 (b) VALUES (TIMESTAMPADD(HOUR, 57, '2001-01-01 00:00:00'));
INSERT INTO t1 (b) VALUES (TIMESTAMPADD(HOUR, 58, '2001-01-01 00:00:00'));
INSERT INTO t1 (b) VALUES (TIMESTAMPADD(HOUR, 59, '2001-01-01 00:00:00'));
INSERT INTO t1 (b) VALUES (TIMESTAMPADD(HOUR, 60, '2001-01-01 00:00:00'));
INSERT INTO t1 (b) VALUES (TIMESTAMPADD(HOUR, 61, '2001-01-01 00:00:00'));
INSERT INTO t1 (b) VALUES (TIMESTAMPADD(HOUR, 62, '2001-01-01 00:00:00'));
INSERT INTO t1 (b) VALUES (TIMESTAMPADD(HOUR, 63, '2001-01-01 00:00:00'));
INSERT INTO t1 (b) VALUES (TIMESTAMPADD(HOUR, 64, '2001-01-01 00:00:00'));
INSERT INTO t1 (b) VALUES (TIMESTAMPADD(HOUR, 65, '2001-01-01 00:00:00'));
INSERT INTO t1 (b) VALUES (TIMESTAMPADD(HOUR, 66, '2001-01-01 00:00:00'));
INSERT INTO t1 (b) VALUES (TIMESTAMPADD(HOUR, 67, '2001-01-01 00:00:00'));
INSERT INTO t1 (b) VALUES (TIMESTAMPADD(HOUR, 68, '2001-01-01 00:00:00'));
INSERT INTO t1 (b) VALUES (TIMESTAMPADD(HOUR, 69, '2001-01-01 00:00:00'));
INSERT INTO t1 (b) VALUES (TIMESTAMPADD(HOUR, 70, '2001-01-01 00:00:00'));
INSERT INTO t1 (b) VALUES (TIMESTAMPADD(HOUR, 71, '2001-01-01 00:00:00'));
SELECT PARTITION_NAME, TABLE_ROWS FROM INFORMATION_SCHEMA.PARTITIONS
WHERE TABLE_NAME = 't1';
PARTITION_NAME	TABLE_ROWS
p0	24
p1	24
p2	24
INSERT INTO t1 (b) VALUES (TIMESTAMPADD(HOUR, -1, '2001-01-01 00:00:00'));
ERROR HY000: Table has no partition for value 20001231
INSERT INTO t1 (b) VALUES (TIMESTAMPADD(HOUR, 72, '2001-01-01 00:00:00'));
ERROR HY000: Table has no partition for value 20010104
SELECT COUNT(*) FROM t1;
COUNT(*)
72
ALTER TABLE t1 DROP PARTITION p0;
SELECT COUNT(*) FROM t1;
COUNT(*)
48
INSERT INTO t1 (b) VALUES ('2001-01-01 01:00:00');
ERROR HY000: Table has no partition for value 20010101
ALTER TABLE t1 ADD PARTITION (PARTITION `p3` VALUES IN (20010104));
INSERT INTO t1 (b) VALUES (TIMESTAMPADD(HOUR, 72, '2001-01-01 00:00:00'));
INSERT INTO t1 (b) VALUES (TIMESTAMPADD(HOUR, 84, '2001-01-01 00:00:00'));
SELECT PARTITION_NAME, TABLE_ROWS FROM INFORMATION_SCHEMA.PARTITIONS
WHERE TABLE_NAME = 't1';
PARTITION_NAME	TABLE_ROWS
p1	24
p2	24
p3	2
DROP TABLE t1;
SET @@SESSION.time_zone = @old_time_zone;
