#
# Test Twitter query stats and I_S.query_statistics
#
SET @old_twitter_query_stats= @@global.twitter_query_stats;
SET @old_twitter_query_stats_max= @@global.twitter_query_stats_max;
create table e_1_0360_e (src integer, dst integer, st integer);
create table e_2_0160_m (src integer, cnt integer, st integer);
SET GLOBAL twitter_query_stats=1;
INSERT INTO e_1_0360_e (src, dst, st) VALUES (336404498,14173346,0) /*["client_host" : "127.0.0.1", "client_id" : "tbird", "service_name" : "test"]*/;
INSERT INTO e_2_0160_m VALUES (244693074, 1, 0) ON DUPLICATE KEY UPDATE cnt = cnt + (CASE st WHEN 0 THEN 1 WHEN 1 THEN -1 ELSE 0 END);
SELECT dst FROM e_1_0360_e where src = 102194292 AND st IN(0) AND dst IN (1256420941,1192146938,1142100012,1136381576,1126594460,1100798592);
dst
(SELECT dst FROM e_1_0360_e WHERE src = 236738600 AND st IN (0) AND dst >=629636489 ORDER BY dst ASC LIMIT 1) UNION ALL (SELECT dst FROM e_1_0360_e WHERE src = 236738600 AND st IN (0) AND dst <629636489 ORDER BY dst DESC LIMIT 1101) /*["client_host" : "127.0.0.1", "service_name" : "test"]*/;
dst
DELETE FROM e_1_0360_e WHERE src = 961210320 AND dst = 790271982 AND st = 1 LIMIT 1 /*["client_host" : "127.0.0.1", "client_id" : "flock_service", "service_name" : "test"]*/;
SELECT dst FROM e_1_0360_e where src = 201249692 AND st IN(0) AND dst IN (501806312,498610405,497759503,491359093);
dst
DELETE FROM e_1_0360_e WHERE src = 69212023 AND dst = 977022891 AND st = 0 LIMIT 2 /*["client_host" : "127.0.0.1", "client_id" : "flock_service", "service_name" : "test"]*/;
SELECT query_type, client_id, count FROM information_schema.query_statistics order by count;
query_type	client_id	count
SELECT query_type, client_id, count FROM information_schema.query_statistics order by count		0
INSERT INTO e_?_?_e (src, dst, st) VALUES (?) 		1
INSERT INTO e_?_?_m VALUES (?) ON DUPLICATE KEY UPDATE cnt = cnt + (CASE st WHEN ? THEN ? WHEN ? THEN ? ELSE ? END)		1
(SELECT dst FROM e_?_?_e WHERE src = ? AND st IN (?) AND dst >=? ORDER BY dst ASC LIMIT ?) UNION ALL (SELECT dst FROM e_?_?_e WHERE src = ? AND st IN (?) AND dst <? ORDER BY dst DESC LIMIT ?) 		1
DELETE FROM e_?_?_e WHERE src = ? AND dst = ? AND st = ? LIMIT ? 		2
SELECT dst FROM e_?_?_e where src = ? AND st IN(?) AND dst IN (?)		2
# change to query stats per client_id
SET GLOBAL twitter_query_stats=0;
SET GLOBAL twitter_query_stats=2;
DELETE FROM e_1_0360_e WHERE src = 961210320 AND dst = 790271982 AND st = 1 LIMIT 1 /*["client_host" : "127.0.0.1", "client_id" : "flock_service", "service_name" : "test"]*/;
SELECT dst FROM e_1_0360_e where src = 201249692 AND st IN(0) AND dst IN (501806312,498610405,497759503,491359093);
dst
DELETE FROM e_1_0360_e WHERE src = 69212023 AND dst = 977022891 AND st = 0 LIMIT 2 /*["client_host" : "127.0.0.1", "client_id" : "tflock_timeline_service", "service_name" : "test"]*/;
(SELECT dst FROM e_1_0360_e WHERE src = 236738600 AND st IN (0) AND dst >=629636489 ORDER BY dst ASC LIMIT 1) UNION ALL (SELECT dst FROM e_1_0360_e WHERE src = 236738600 AND st IN (0) AND dst <629636489 ORDER BY dst DESC LIMIT 250) /*["client_host" : "127.0.0.1", "client_id" : "tflock_timeline_service", "service_name" : "test"]*/;
dst
(SELECT dst FROM e_1_0360_e WHERE src = 347849711 AND st IN (0) AND dst >=518636489 ORDER BY dst ASC LIMIT 1) UNION ALL (SELECT dst FROM e_1_0360_e WHERE src = 347849711 AND st IN (3) AND dst <518636489 ORDER BY dst DESC LIMIT 251) /*["client_host" : "127.0.0.1", "client_id" : "flock_service", "service_name" : "test"]*/;
dst
SELECT query_type, client_id, count FROM information_schema.query_statistics order by client_id,count;
query_type	client_id	count
INSERT INTO e_?_?_e (src, dst, st) VALUES (?) 		0
INSERT INTO e_?_?_m VALUES (?) ON DUPLICATE KEY UPDATE cnt = cnt + (CASE st WHEN ? THEN ? WHEN ? THEN ? ELSE ? END)		0
SELECT query_type, client_id, count FROM information_schema.query_statistics order by client_id,count		0
(SELECT dst FROM e_?_?_e WHERE src = ? AND st IN (?) AND dst >=? ORDER BY dst ASC LIMIT ?) UNION ALL (SELECT dst FROM e_?_?_e WHERE src = ? AND st IN (?) AND dst <? ORDER BY dst DESC LIMIT ?) 		0
SELECT query_type, client_id, count FROM information_schema.query_statistics order by count		0
DELETE FROM e_?_?_e WHERE src = ? AND dst = ? AND st = ? LIMIT ? 		0
SELECT dst FROM e_?_?_e where src = ? AND st IN(?) AND dst IN (?)		1
DELETE FROM e_?_?_e WHERE src = ? AND dst = ? AND st = ? LIMIT ? 	flock_service	1
(SELECT dst FROM e_?_?_e WHERE src = ? AND st IN (?) AND dst >=? ORDER BY dst ASC LIMIT ?) UNION ALL (SELECT dst FROM e_?_?_e WHERE src = ? AND st IN (?) AND dst <? ORDER BY dst DESC LIMIT ?) 	flock_service	1
DELETE FROM e_?_?_e WHERE src = ? AND dst = ? AND st = ? LIMIT ? 	tflock_timeline_service	1
(SELECT dst FROM e_?_?_e WHERE src = ? AND st IN (?) AND dst >=? ORDER BY dst ASC LIMIT ?) UNION ALL (SELECT dst FROM e_?_?_e WHERE src = ? AND st IN (?) AND dst <? ORDER BY dst DESC LIMIT ?) 	tflock_timeline_service	1
# examine row stats
SELECT query_type, client_id, rows_sent, rows_examined FROM information_schema.query_statistics order by client_id,rows_sent;
query_type	client_id	rows_sent	rows_examined
INSERT INTO e_?_?_e (src, dst, st) VALUES (?) 		0	0
INSERT INTO e_?_?_m VALUES (?) ON DUPLICATE KEY UPDATE cnt = cnt + (CASE st WHEN ? THEN ? WHEN ? THEN ? ELSE ? END)		0	0
(SELECT dst FROM e_?_?_e WHERE src = ? AND st IN (?) AND dst >=? ORDER BY dst ASC LIMIT ?) UNION ALL (SELECT dst FROM e_?_?_e WHERE src = ? AND st IN (?) AND dst <? ORDER BY dst DESC LIMIT ?) 		0	0
SELECT query_type, client_id, rows_sent, rows_examined FROM information_schema.query_statistics order by client_id,rows_sent		0	0
SELECT dst FROM e_?_?_e where src = ? AND st IN(?) AND dst IN (?)		0	0
SELECT query_type, client_id, count FROM information_schema.query_statistics order by count		0	0
DELETE FROM e_?_?_e WHERE src = ? AND dst = ? AND st = ? LIMIT ? 		0	0
SELECT query_type, client_id, count FROM information_schema.query_statistics order by client_id,count		11	22
DELETE FROM e_?_?_e WHERE src = ? AND dst = ? AND st = ? LIMIT ? 	flock_service	0	1
(SELECT dst FROM e_?_?_e WHERE src = ? AND st IN (?) AND dst >=? ORDER BY dst ASC LIMIT ?) UNION ALL (SELECT dst FROM e_?_?_e WHERE src = ? AND st IN (?) AND dst <? ORDER BY dst DESC LIMIT ?) 	flock_service	0	0
DELETE FROM e_?_?_e WHERE src = ? AND dst = ? AND st = ? LIMIT ? 	tflock_timeline_service	0	1
(SELECT dst FROM e_?_?_e WHERE src = ? AND st IN (?) AND dst >=? ORDER BY dst ASC LIMIT ?) UNION ALL (SELECT dst FROM e_?_?_e WHERE src = ? AND st IN (?) AND dst <? ORDER BY dst DESC LIMIT ?) 	tflock_timeline_service	0	0
# change query stats max to small value
FLUSH STATUS;
SET GLOBAL twitter_query_stats_max=5;
INSERT INTO e_1_0360_e (src, dst, st) VALUES (336404498,14173346,0) /*["client_host" : "127.0.0.1", "client_id" : "tbird", "service_name" : "test"]*/;
DELETE FROM e_1_0360_e WHERE src = 961210320 AND dst = 790271982 AND st = 1 LIMIT 1 /*["client_host" : "127.0.0.1", "client_id" : "millions_birds_none_stop_fly_service_twenty_four_seven", "service_name" : "test"]*/;
# expect to not see above query types
SELECT query_type, hash_code, client_id, count FROM information_schema.query_statistics where client_id="tbird";
query_type	hash_code	client_id	count
SELECT query_type, hash_code, client_id, count FROM information_schema.query_statistics where client_id="flock_service";
query_type	hash_code	client_id	count
DELETE FROM e_?_?_e WHERE src = ? AND dst = ? AND st = ? LIMIT ? 	3329949968	flock_service	0
(SELECT dst FROM e_?_?_e WHERE src = ? AND st IN (?) AND dst >=? ORDER BY dst ASC LIMIT ?) UNION ALL (SELECT dst FROM e_?_?_e WHERE src = ? AND st IN (?) AND dst <? ORDER BY dst DESC LIMIT ?) 	1915139386	flock_service	0
DROP TABLE e_1_0360_e;
DROP TABLE e_2_0160_m;
SET global twitter_query_stats = @old_twitter_query_stats;
SET global twitter_query_stats_max = @old_twitter_query_stats_max;
