# Create a global status view that converts the type of the
# VARIABLE_VALUE column from a string to an unsigned integer.
CREATE VIEW gsv AS SELECT VARIABLE_NAME, CONVERT(VARIABLE_VALUE, UNSIGNED)
AS VARIABLE_VALUE FROM INFORMATION_SCHEMA.GLOBAL_STATUS;
#
# Export InnoDB's thread concurrency information.
#
SET @old_innodb_file_per_table = @@GLOBAL.innodb_file_per_table;
SET GLOBAL innodb_file_per_table = ON;
CREATE TABLE t1 (a INT PRIMARY KEY, b INT) ENGINE=InnoDB;
INSERT INTO t1 VALUES (1,1),(2,2),(3,3),(4,4),(5,5);
SET @old_innodb_thread_concurrency = @@GLOBAL.innodb_thread_concurrency;
# Only one thread is allowed inside InnoDB (for row operations).
SET GLOBAL innodb_thread_concurrency = 1;
# Start transactions within InnoDB.
# Connection: con1
BEGIN;
SELECT * FROM t1 WHERE a = 1;
a	b
1	1
# Connection: con2
BEGIN;
SELECT * FROM t1 WHERE a = 2;
a	b
2	2
# Connection: default
# Record active/waiting status values.
SELECT VARIABLE_VALUE INTO @threads_active FROM gsv WHERE
VARIABLE_NAME = 'INNODB_THREAD_CONCURRENCY_ACTIVE';
SELECT VARIABLE_VALUE INTO @threads_waiting FROM gsv WHERE
VARIABLE_NAME = 'INNODB_THREAD_CONCURRENCY_WAITING';
# Connection: con1
# Park an active thread inside InnoDB.
SET DEBUG_SYNC='innodb_row_update_for_mysql_begin SIGNAL inside_innodb WAIT_FOR go';
UPDATE t1 SET a = 6, b = 6 WHERE a = 1;
# Connection: default
SET DEBUG_SYNC='now WAIT_FOR inside_innodb';
# Connection: con2
# Park thread in InnoDB's concurrency queue.
DELETE FROM t1 WHERE a = 2;
# Connection: default
# Wait for thread to be pushed to the queue.
# Ensure that the status counters are incremented.
SELECT COUNT(*) FROM gsv WHERE
VARIABLE_NAME = 'INNODB_THREAD_CONCURRENCY_ACTIVE' AND
VARIABLE_VALUE > @threads_active;
COUNT(*)
1
SELECT COUNT(*) FROM gsv WHERE
VARIABLE_NAME = 'INNODB_THREAD_CONCURRENCY_WAITING' AND
VARIABLE_VALUE > @threads_waiting;
COUNT(*)
1
SET DEBUG_SYNC='now SIGNAL go';
# Connection: con1
# Connection: con2
# Connection: default
DROP TABLE t1;
SET GLOBAL innodb_thread_concurrency = @old_innodb_thread_concurrency;
SET GLOBAL innodb_file_per_table = @old_innodb_file_per_table;
#
# Cleanup
#
DROP VIEW gsv;
